url,status,credibility,notes,checked
https://www.reddit.com/r/immortalists/comments/1p9ais5/avocados_significantly_increase_lifespan_here_are/,removed,anecdotal,"Reddit post — lead not a primary source; removed from references",2026-03-10
https://pubmed.ncbi.nlm.nih.gov/25567051/,valid,strong,"RCT: adding avocado to moderate-fat diet reduces LDL particle number and small dense LDL in overweight adults",2026-03-10
https://academic.oup.com/jn/article/150/2/276/5588100,valid,moderate,"Journal of Nutrition study on avocado consumption and cardiovascular biomarkers (not yet visited — reputable journal)",2026-03-10
https://pubmed.ncbi.nlm.nih.gov/40612140/,valid,strong,"GRADE meta-analysis (2025): avocado products significantly reduce total cholesterol, LDL, and triglycerides",2026-03-10
https://pubmed.ncbi.nlm.nih.gov/36565850/,valid,strong,"Systematic review and meta-analysis: avocado reduces TC and LDL in people with hypercholesterolemia; no negative weight impact",2026-03-10
https://pubmed.ncbi.nlm.nih.gov/35352568/,valid,strong,"Harvard prospective cohort (68786 women, 41701 men, 30y): 2+ servings/week avocado associated with 16% lower CVD risk",2026-03-10
https://pubmed.ncbi.nlm.nih.gov/39641169/,valid,strong,"HAT RCT ancillary (1008 adults, 26w): daily avocado increased gut microbial diversity and enriched F. prausnitzii; benefits strongest in low diet-quality subgroup",2026-04-09
https://pubmed.ncbi.nlm.nih.gov/39968784/,valid,moderate,"HAT RCT ancillary (969 adults, 26w): daily avocado improved LE8 subscores for diet quality, sleep, and blood lipids; overall CVD score not significant",2026-04-09
