url,status,credibility,notes,checked
https://examine.com/topics/intermittent-fasting/,valid,strong,"Examine.com evidence summary on intermittent fasting; covers metabolic benefits and autophagy with nuanced evidence ratings",2026-03-08
https://www.ncbi.nlm.nih.gov/pmc/articles/PMC4250148/,valid,strong,"PMC review on intermittent fasting and metabolic health in humans",2026-03-08
https://pmc.ncbi.nlm.nih.gov/articles/PMC12289860/,valid,strong,"2025 systematic review and network meta-analysis of 56 RCTs; IF reduces weight, LDL, BP, fasting glucose vs usual diet; modified ADF most effective",2026-04-09
https://pmc.ncbi.nlm.nih.gov/articles/PMC12309044/,valid,strong,"2025 Nutrition Journal meta-analysis of 15 RCTs in overweight adults; confirms body fat, LDL, and fasting glucose reductions",2026-04-09
https://www.nature.com/articles/s41467-025-66366-8,valid,strong,"2025 Nature Communications 6-month RCT; 8% weight loss, 16% body fat reduction, significant LDL and triglyceride improvements in middle-aged adults",2026-04-09
https://www.thelancet.com/journals/eclinm/article/PIIS2589-53702400098-1/fulltext,valid,strong,"Lancet eClinicalMedicine umbrella review of IF systematic reviews and meta-analyses; IF comparable to continuous caloric restriction short-term; highlights nuance on independence of benefits",2026-04-09
